No.,Time,Source,Destination,Protocol,Length,Info,,,,,,,,,,time 1,time 2 ,delay 1,delay 2,jiter
13,5.764238,192.168.43.125,172.217.194.94,TCP,55,49197  >  443 [ACK] Seq=1 Ack=1 Win=255 Len=1 [TCP segment of a reassembled PDU],,,,,,,,,,5.857157,5.764238,0.092919,5.671319,5.5784
14,5.857157,172.217.194.94,192.168.43.125,TCP,54,443  >  49197 [RST] Seq=1 Win=0 Len=0,,,,,,,,,,6.844275,5.857157,0.987118,4.870039,3.882921
17,6.844275,192.168.43.125,103.208.137.6,TCP,55,49217  >  443 [ACK] Seq=1 Ack=1 Win=63612 Len=1 [TCP segment of a reassembled PDU],,,,,,,,,,6.932795,6.844275,0.08852,6.755755,6.667235
20,6.932795,103.208.137.6,192.168.43.125,TCP,66,443  >  49217 [ACK] Seq=1 Ack=2 Win=63784 Len=0 SLE=1 SRE=2,,,,,,,,,,8.395384,6.932795,1.462589,5.470206,4.007617
26,8.395384,192.168.43.125,74.125.24.138,TCP,55,49227  >  443 [ACK] Seq=1 Ack=1 Win=255 Len=1 [TCP segment of a reassembled PDU],,,,,,,,,,8.474,8.395384,0.078616,8.316768,8.238152
27,8.474,74.125.24.138,192.168.43.125,TCP,66,443  >  49227 [ACK] Seq=1 Ack=2 Win=265 Len=0 SLE=1 SRE=2,,,,,,,,,,11.476351,8.474,3.002351,5.471649,2.469298
37,11.476351,192.168.43.125,74.125.24.138,TCP,55,49226  >  443 [ACK] Seq=1 Ack=1 Win=256 Len=1 [TCP segment of a reassembled PDU],,,,,,,,,,13.956454,11.476351,2.480103,8.996248,6.516145
38,13.956454,192.168.43.125,172.217.194.94,TCP,55,49196  >  443 [ACK] Seq=1 Ack=1 Win=258 Len=1 [TCP segment of a reassembled PDU],,,,,,,,,,14.865549,13.956454,0.909095,13.047359,12.138264
40,14.865549,192.168.43.125,103.208.137.6,TCP,55,49180  >  443 [ACK] Seq=1 Ack=1 Win=255 Len=1 [TCP segment of a reassembled PDU],,,,,,,,,,15.866587,14.865549,1.001038,13.864511,12.863473
41,15.866587,192.168.43.125,103.208.137.6,TCP,55,49214  >  443 [ACK] Seq=1 Ack=1 Win=254 Len=1 [TCP segment of a reassembled PDU],,,,,,,,,,15.914617,15.866587,0.04803,15.818557,15.770527
42,15.914617,192.168.43.125,103.208.137.6,TCP,55,49213  >  443 [ACK] Seq=1 Ack=1 Win=258 Len=1 [TCP segment of a reassembled PDU],,,,,,,,,,17.046554,15.914617,1.131937,14.78268,13.650743
43,17.046554,192.168.43.125,103.208.137.6,TCP,55,49220  >  443 [ACK] Seq=1 Ack=1 Win=254 Len=1 [TCP segment of a reassembled PDU],,,,,,,,,,17.154003,17.046554,0.107449,16.939105,16.831656
44,17.154003,103.208.137.6,192.168.43.125,TCP,66,443  >  49220 [ACK] Seq=1 Ack=2 Win=501 Len=0 SLE=1 SRE=2,,,,,,,,,,18.456619,17.154003,1.302616,15.851387,14.548771
46,18.456619,192.168.43.125,74.125.68.188,TCP,55,49171  >  5228 [ACK] Seq=1 Ack=1 Win=256 Len=1,,,,,,,,,,18.536229,18.456619,0.07961,18.377009,18.297399
47,18.536229,74.125.68.188,192.168.43.125,TCP,66,5228  >  49171 [ACK] Seq=1 Ack=2 Win=265 Len=0 SLE=1 SRE=2,,,,,,,,,,28.336033,18.536229,9.799804,8.736425,1.063379
64,28.336033,192.168.43.125,74.125.68.157,TCP,55,49199  >  443 [ACK] Seq=1 Ack=1 Win=254 Len=1 [TCP segment of a reassembled PDU],,,,,,,,,,28.452379,28.336033,0.116346,28.219687,28.103341
68,28.452379,74.125.68.157,192.168.43.125,TCP,66,443  >  49199 [ACK] Seq=1 Ack=2 Win=269 Len=0 SLE=1 SRE=2,,,,,,,,,,30.447125,28.452379,1.994746,26.457633,24.462887
77,30.447125,192.168.43.125,104.22.52.65,TCP,55,49221  >  443 [ACK] Seq=1 Ack=1 Win=256 Len=1 [TCP segment of a reassembled PDU],,,,,,,,,,30.696624,30.447125,0.249499,30.197626,29.948127
78,30.696624,104.22.52.65,192.168.43.125,TCP,66,443  >  49221 [ACK] Seq=1 Ack=2 Win=68 Len=0 SLE=1 SRE=2,,,,,,,,,,34.465271,30.696624,3.768647,26.927977,23.15933
81,34.465271,192.168.43.125,23.111.9.35,TCP,55,49219  >  443 [ACK] Seq=1 Ack=1 Win=64860 Len=1 [TCP segment of a reassembled PDU],,,,,,,,,,39.307679,34.465271,4.842408,29.622863,24.780455
83,39.307679,192.168.43.125,74.125.200.102,TCP,54,"49224  >  80 [RST, ACK] Seq=1 Ack=1 Win=0 Len=0",,,,,,,,,,41.410502,39.307679,2.102823,37.204856,35.102033
85,41.410502,74.125.68.157,192.168.43.125,TLSv1.2,110,Application Data,,,,,,,,,,41.41091,41.410502,0.000408,41.410094,41.409686
86,41.41091,192.168.43.125,74.125.68.157,TCP,54,"49199  >  443 [FIN, ACK] Seq=2 Ack=57 Win=254 Len=0",,,,,,,,,,41.475877,41.41091,0.064967,41.345943,41.280976
87,41.475877,74.125.68.157,192.168.43.125,TCP,54,[TCP Previous segment not captured] 443  >  49199 [ACK] Seq=58 Ack=3 Win=269 Len=0,,,,,,,,,,41.906606,41.475877,0.430729,41.045148,40.614419
88,41.906606,74.125.68.157,192.168.43.125,TCP,54,"[TCP Retransmission] 443  >  49199 [FIN, ACK] Seq=57 Ack=3 Win=269 Len=0",,,,,,,,,,41.906716,41.906606,0.00011,41.906496,41.906386
89,41.906716,192.168.43.125,74.125.68.157,TCP,54,49199  >  443 [ACK] Seq=3 Ack=58 Win=254 Len=0,,,,,,,,,,51.930884,41.906716,10.024168,31.882548,21.85838
104,51.930884,192.168.43.125,103.208.137.6,TCP,55,[TCP Keep-Alive] 49217  >  443 [ACK] Seq=1 Ack=1 Win=63612 Len=1,,,,,,,,,,53.470939,51.930884,1.540055,50.390829,48.850774
109,53.470939,192.168.43.125,74.125.24.138,TCP,55,[TCP Keep-Alive] 49227  >  443 [ACK] Seq=1 Ack=1 Win=255 Len=1,,,,,,,,,,53.554254,53.470939,0.083315,53.387624,53.304309
110,53.554254,74.125.24.138,192.168.43.125,TCP,66,[TCP Keep-Alive ACK] 443  >  49227 [ACK] Seq=1 Ack=2 Win=265 Len=0 SLE=1 SRE=2,,,,,,,,,,56.47599,53.554254,2.921736,50.632518,47.710782
119,56.47599,192.168.43.125,74.125.24.138,TCP,55,[TCP Keep-Alive] 49226  >  443 [ACK] Seq=1 Ack=1 Win=256 Len=1,,,,,,,,,,58.957071,56.47599,2.481081,53.994909,51.513828
123,58.957071,192.168.43.125,172.217.194.94,TCP,55,[TCP Keep-Alive] 49196  >  443 [ACK] Seq=1 Ack=1 Win=258 Len=1,,,,,,,,,,59.032857,58.957071,0.075786,58.881285,58.805499
124,59.032857,172.217.194.94,192.168.43.125,TCP,66,443  >  49196 [ACK] Seq=1 Ack=2 Win=321 Len=0 SLE=1 SRE=2,,,,,,,,,,59.871114,59.032857,0.838257,58.1946,57.356343
125,59.871114,192.168.43.125,103.208.137.6,TCP,55,[TCP Keep-Alive] 49180  >  443 [ACK] Seq=1 Ack=1 Win=255 Len=1,,,,,,,,,,59.972199,59.871114,0.101085,59.770029,59.668944
126,59.972199,103.208.137.6,192.168.43.125,TCP,66,443  >  49180 [ACK] Seq=1 Ack=2 Win=501 Len=0 SLE=1 SRE=2,,,,,,,,,,60.867233,59.972199,0.895034,59.077165,58.182131
127,60.867233,192.168.43.125,103.208.137.6,TCP,55,[TCP Keep-Alive] 49214  >  443 [ACK] Seq=1 Ack=1 Win=254 Len=1,,,,,,,,,,60.911216,60.867233,0.043983,60.82325,60.779267
128,60.911216,192.168.43.125,103.208.137.6,TCP,55,[TCP Keep-Alive] 49213  >  443 [ACK] Seq=1 Ack=1 Win=258 Len=1,,,,,,,,,,60.973196,60.911216,0.06198,60.849236,60.787256
129,60.973196,103.208.137.6,192.168.43.125,TCP,66,443  >  49214 [ACK] Seq=1 Ack=2 Win=501 Len=0 SLE=1 SRE=2,,,,,,,,,,61.013655,60.973196,0.040459,60.932737,60.892278
131,61.013655,103.208.137.6,192.168.43.125,TCP,66,443  >  49213 [ACK] Seq=1 Ack=2 Win=501 Len=0 SLE=1 SRE=2,,,,,,,,,,62.147264,61.013655,1.133609,59.880046,58.746437
132,62.147264,192.168.43.125,103.208.137.6,TCP,55,[TCP Keep-Alive] 49220  >  443 [ACK] Seq=1 Ack=1 Win=254 Len=1,,,,,,,,,,62.253021,62.147264,0.105757,62.041507,61.93575
133,62.253021,103.208.137.6,192.168.43.125,TCP,66,[TCP Keep-Alive ACK] 443  >  49220 [ACK] Seq=1 Ack=2 Win=501 Len=0 SLE=1 SRE=2,,,,,,,,,,63.537243,62.253021,1.284222,60.968799,59.684577
134,63.537243,192.168.43.125,74.125.68.188,TCP,55,[TCP Keep-Alive] 49171  >  5228 [ACK] Seq=1 Ack=1 Win=256 Len=1,,,,,,,,,,63.6147,63.537243,0.077457,63.459786,63.382329
135,63.6147,74.125.68.188,192.168.43.125,TCP,66,[TCP Keep-Alive ACK] 5228  >  49171 [ACK] Seq=1 Ack=2 Win=265 Len=0 SLE=1 SRE=2,,,,,,,,,,75.701759,63.6147,12.087059,51.527641,39.440582
159,75.701759,192.168.43.125,104.22.52.65,TCP,55,[TCP Keep-Alive] 49221  >  443 [ACK] Seq=1 Ack=1 Win=256 Len=1,,,,,,,,,,79.458901,75.701759,3.757142,71.944617,68.187475
161,79.458901,192.168.43.125,23.111.9.35,TCP,55,[TCP Keep-Alive] 49219  >  443 [ACK] Seq=1 Ack=1 Win=64860 Len=1,,,,,,,,,,96.929532,79.458901,17.470631,61.98827,44.517639
184,96.929532,192.168.43.125,103.208.137.6,TCP,55,[TCP Keep-Alive] 49217  >  443 [ACK] Seq=1 Ack=1 Win=63612 Len=1,,,,,,,,,,98.548653,96.929532,1.619121,95.310411,93.69129
186,98.548653,192.168.43.125,74.125.24.138,TCP,55,[TCP Keep-Alive] 49227  >  443 [ACK] Seq=1 Ack=1 Win=255 Len=1,,,,,,,,,,98.736342,98.548653,0.187689,98.360964,98.173275
187,98.736342,74.125.24.138,192.168.43.125,TCP,66,[TCP Keep-Alive ACK] 443  >  49227 [ACK] Seq=1 Ack=2 Win=265 Len=0 SLE=1 SRE=2,,,,,,,,,,101.47561,98.736342,2.739268,95.997074,93.257806
189,101.47561,192.168.43.125,74.125.24.138,TCP,55,[TCP Keep-Alive] 49226  >  443 [ACK] Seq=1 Ack=1 Win=256 Len=1,,,,,,,,,,101.6651,101.47561,0.18949,101.28612,101.09663
190,101.6651,74.125.24.138,192.168.43.125,TCP,66,443  >  49226 [ACK] Seq=1 Ack=2 Win=261 Len=0 SLE=1 SRE=2,,,,,,,,,,104.031789,101.6651,2.366689,99.298411,96.931722
196,104.031789,192.168.43.125,172.217.194.94,TCP,55,[TCP Keep-Alive] 49196  >  443 [ACK] Seq=1 Ack=1 Win=258 Len=1,,,,,,,,,,104.968883,104.031789,0.937094,103.094695,102.157601
197,104.968883,192.168.43.125,103.208.137.6,TCP,55,[TCP Keep-Alive] 49180  >  443 [ACK] Seq=1 Ack=1 Win=255 Len=1,,,,,,,,,,105.173283,104.968883,0.2044,104.764483,104.560083
198,105.173283,103.208.137.6,192.168.43.125,TCP,66,[TCP Keep-Alive ACK] 443  >  49180 [ACK] Seq=1 Ack=2 Win=501 Len=0 SLE=1 SRE=2,,,,,,,,,,105.971825,105.173283,0.798542,104.374741,103.576199
199,105.971825,192.168.43.125,103.208.137.6,TCP,55,[TCP Keep-Alive] 49214  >  443 [ACK] Seq=1 Ack=1 Win=254 Len=1,,,,,,,,,,106.009846,105.971825,0.038021,105.933804,105.895783
200,106.009846,192.168.43.125,103.208.137.6,TCP,55,[TCP Keep-Alive] 49213  >  443 [ACK] Seq=1 Ack=1 Win=258 Len=1,,,,,,,,,,107.251899,106.009846,1.242053,104.767793,103.52574
201,107.251899,192.168.43.125,103.208.137.6,TCP,55,[TCP Keep-Alive] 49220  >  443 [ACK] Seq=1 Ack=1 Win=254 Len=1,,,,,,,,,,108.611954,107.251899,1.360055,105.891844,104.531789
203,108.611954,192.168.43.125,74.125.68.188,TCP,55,[TCP Keep-Alive] 49171  >  5228 [ACK] Seq=1 Ack=1 Win=256 Len=1,,,,,,,,,,112.252388,108.611954,3.640434,104.97152,101.331086
205,112.252388,23.111.9.35,192.168.43.125,SSL,1434,Continuation Data,,,,,,,,,,112.4501,112.252388,0.197712,112.054676,111.856964
206,112.4501,192.168.43.125,23.111.9.35,TCP,54,49219  >  443 [ACK] Seq=2 Ack=1381 Win=64860 Len=0,,,,,,,,,,112.886163,112.4501,0.436063,112.014037,111.577974
208,112.886163,23.111.9.35,192.168.43.125,SSL,1434,Continuation Data,,,,,,,,,,112.886958,112.886163,0.000795,112.885368,112.884573
209,112.886958,23.111.9.35,192.168.43.125,SSL,1434,Continuation Data,,,,,,,,,,112.887069,112.886958,0.000111,112.886847,112.886736
210,112.887069,192.168.43.125,23.111.9.35,TCP,54,49219  >  443 [ACK] Seq=2 Ack=4141 Win=64860 Len=0,,,,,,,,,,117.411166,112.887069,4.524097,108.362972,103.838875
230,117.411166,172.217.194.94,192.168.43.125,TLSv1.2,110,Application Data,,,,,,,,,,117.411299,117.411166,0.000133,117.411033,117.4109
231,117.411299,172.217.194.94,192.168.43.125,TCP,54,"443  >  49196 [FIN, ACK] Seq=57 Ack=2 Win=321 Len=0",,,,,,,,,,117.411344,117.411299,4.5E-05,117.411254,117.411209
232,117.411344,192.168.43.125,172.217.194.94,TCP,54,49196  >  443 [ACK] Seq=2 Ack=58 Win=258 Len=0,,,,,,,,,,117.41163,117.411344,0.000286,117.411058,117.410772
233,117.41163,192.168.43.125,172.217.194.94,TCP,54,"49196  >  443 [FIN, ACK] Seq=2 Ack=58 Win=258 Len=0",,,,,,,,,,120.411385,117.41163,2.999755,114.411875,111.41212
238,120.411385,192.168.43.125,172.217.194.94,TCP,54,"[TCP Retransmission] 49196  >  443 [FIN, ACK] Seq=2 Ack=58 Win=258 Len=0",,,,,,,,,,120.701401,120.411385,0.290016,120.121369,119.831353
239,120.701401,192.168.43.125,104.22.52.65,TCP,55,[TCP Keep-Alive] 49221  >  443 [ACK] Seq=1 Ack=1 Win=256 Len=1,,,,,,,,,,120.724119,120.701401,0.022718,120.678683,120.655965
240,120.724119,172.217.194.94,192.168.43.125,TCP,54,"443  >  49196 [RST, ACK] Seq=58 Ack=3 Win=258 Len=0",,,,,,,,,,141.932127,120.724119,21.208008,99.516111,78.308103
267,141.932127,192.168.43.125,103.208.137.6,TCP,55,[TCP Keep-Alive] 49217  >  443 [ACK] Seq=1 Ack=1 Win=63612 Len=1,,,,,,,,,,142.032424,141.932127,0.100297,141.83183,141.731533
270,142.032424,103.208.137.6,192.168.43.125,TCP,66,[TCP Keep-Alive ACK] 443  >  49217 [ACK] Seq=1 Ack=2 Win=63784 Len=0 SLE=1 SRE=2,,,,,,,,,,143.738272,142.032424,1.705848,140.326576,138.620728
276,143.738272,192.168.43.125,74.125.24.138,TCP,55,[TCP Keep-Alive] 49227  >  443 [ACK] Seq=1 Ack=1 Win=255 Len=1,,,,,,,,,,143.86481,143.738272,0.126538,143.611734,143.485196
277,143.86481,74.125.24.138,192.168.43.125,TCP,66,[TCP Keep-Alive ACK] 443  >  49227 [ACK] Seq=1 Ack=2 Win=265 Len=0 SLE=1 SRE=2,,,,,,,,,,146.655365,143.86481,2.790555,141.074255,138.2837
282,146.655365,192.168.43.125,74.125.24.138,TCP,55,[TCP Keep-Alive] 49226  >  443 [ACK] Seq=1 Ack=1 Win=256 Len=1,,,,,,,,,,146.734458,146.655365,0.079093,146.576272,146.497179
283,146.734458,74.125.24.138,192.168.43.125,TCP,66,[TCP Keep-Alive ACK] 443  >  49226 [ACK] Seq=1 Ack=2 Win=261 Len=0 SLE=1 SRE=2,,,,,,,,,,150.168351,146.734458,3.433893,143.300565,139.866672
287,150.168351,192.168.43.125,103.208.137.6,TCP,55,[TCP Keep-Alive] 49180  >  443 [ACK] Seq=1 Ack=1 Win=255 Len=1,,,,,,,,,,150.254214,150.168351,0.085863,150.082488,149.996625
288,150.254214,103.208.137.6,192.168.43.125,TCP,66,[TCP Keep-Alive ACK] 443  >  49180 [ACK] Seq=1 Ack=2 Win=501 Len=0 SLE=1 SRE=2,,,,,,,,,,150.971469,150.254214,0.717255,149.536959,148.819704
289,150.971469,192.168.43.125,103.208.137.6,TCP,55,[TCP Keep-Alive] 49214  >  443 [ACK] Seq=1 Ack=1 Win=254 Len=1,,,,,,,,,,151.012463,150.971469,0.040994,150.930475,150.889481
291,151.012463,192.168.43.125,103.208.137.6,TCP,55,[TCP Keep-Alive] 49213  >  443 [ACK] Seq=1 Ack=1 Win=258 Len=1,,,,,,,,,,151.060918,151.012463,0.048455,150.964008,150.915553
292,151.060918,103.208.137.6,192.168.43.125,TCP,66,[TCP Keep-Alive ACK] 443  >  49214 [ACK] Seq=1 Ack=2 Win=501 Len=0 SLE=1 SRE=2,,,,,,,,,,151.092214,151.060918,0.031296,151.029622,150.998326
293,151.092214,103.208.137.6,192.168.43.125,TCP,66,[TCP Keep-Alive ACK] 443  >  49213 [ACK] Seq=1 Ack=2 Win=501 Len=0 SLE=1 SRE=2,,,,,,,,,,152.251503,151.092214,1.159289,149.932925,148.773636
454,152.251503,192.168.43.125,103.208.137.6,TCP,55,[TCP Keep-Alive] 49220  >  443 [ACK] Seq=1 Ack=1 Win=254 Len=1,,,,,,,,,,152.360628,152.251503,0.109125,152.142378,152.033253
472,152.360628,103.208.137.6,192.168.43.125,TCP,66,[TCP Keep-Alive ACK] 443  >  49220 [ACK] Seq=1 Ack=2 Win=501 Len=0 SLE=1 SRE=2,,,,,,,,,,153.611474,152.360628,1.250846,151.109782,149.858936
1105,153.611474,192.168.43.125,74.125.68.188,TCP,55,[TCP Keep-Alive] 49171  >  5228 [ACK] Seq=1 Ack=1 Win=256 Len=1,,,,,,,,,,153.716491,153.611474,0.105017,153.506457,153.40144
1143,153.716491,74.125.68.188,192.168.43.125,TCP,66,[TCP Keep-Alive ACK] 5228  >  49171 [ACK] Seq=1 Ack=2 Win=265 Len=0 SLE=1 SRE=2,,,,,,,,,,155.842819,153.716491,2.126328,151.590163,149.463835
1569,155.842819,192.168.43.125,103.208.137.6,TCP,54,"49180  >  443 [FIN, ACK] Seq=2 Ack=1 Win=255 Len=0",,,,,,,,,,155.843002,155.842819,0.000183,155.842636,155.842453
1570,155.843002,192.168.43.125,103.208.137.6,TCP,54,"49214  >  443 [FIN, ACK] Seq=2 Ack=1 Win=254 Len=0",,,,,,,,,,155.843117,155.843002,0.000115,155.842887,155.842772
1571,155.843117,192.168.43.125,103.208.137.6,TCP,54,"49220  >  443 [FIN, ACK] Seq=2 Ack=1 Win=254 Len=0",,,,,,,,,,155.843228,155.843117,0.000111,155.843006,155.842895
1572,155.843228,192.168.43.125,103.208.137.6,TCP,54,"49213  >  443 [FIN, ACK] Seq=2 Ack=1 Win=258 Len=0",,,,,,,,,,155.843328,155.843228,0.0001,155.843128,155.843028
1573,155.843328,192.168.43.125,103.208.137.6,TCP,54,"49217  >  443 [FIN, ACK] Seq=2 Ack=1 Win=63612 Len=0",,,,,,,,,,155.843429,155.843328,0.000101,155.843227,155.843126
1574,155.843429,192.168.43.125,74.125.24.138,TCP,54,"49226  >  443 [FIN, ACK] Seq=2 Ack=1 Win=256 Len=0",,,,,,,,,,155.913288,155.843429,0.069859,155.77357,155.703711
1612,155.913288,74.125.24.138,192.168.43.125,TCP,54,"443  >  49226 [FIN, ACK] Seq=1 Ack=3 Win=261 Len=0",,,,,,,,,,155.913396,155.913288,0.000108,155.91318,155.913072
1613,155.913396,192.168.43.125,74.125.24.138,TCP,54,49226  >  443 [ACK] Seq=3 Ack=2 Win=256 Len=0,,,,,,,,,,155.930975,155.913396,0.017579,155.895817,155.878238
1615,155.930975,192.168.43.125,74.125.24.149,TCP,66,49231  >  443 [SYN] Seq=0 Win=8192 Len=0 MSS=1460 WS=256 SACK_PERM=1,,,,,,,,,,155.932398,155.930975,0.001423,155.929552,155.928129
1616,155.932398,103.208.137.6,192.168.43.125,TCP,54,"443  >  49220 [FIN, ACK] Seq=1 Ack=3 Win=501 Len=0",,,,,,,,,,155.932476,155.932398,7.8E-05,155.93232,155.932242
1617,155.932476,192.168.43.125,103.208.137.6,TCP,54,49220  >  443 [ACK] Seq=3 Ack=2 Win=254 Len=0,,,,,,,,,,155.932574,155.932476,9.8E-05,155.932378,155.93228
1618,155.932574,103.208.137.6,192.168.43.125,TCP,54,"443  >  49217 [FIN, ACK] Seq=1 Ack=3 Win=63784 Len=0",,,,,,,,,,155.932611,155.932574,3.7E-05,155.932537,155.9325
1619,155.932611,192.168.43.125,103.208.137.6,TCP,54,49217  >  443 [ACK] Seq=3 Ack=2 Win=63612 Len=0,,,,,,,,,,155.932679,155.932611,6.8E-05,155.932543,155.932475
1620,155.932679,103.208.137.6,192.168.43.125,TCP,54,"443  >  49213 [FIN, ACK] Seq=1 Ack=3 Win=501 Len=0",,,,,,,,,,155.932717,155.932679,3.8E-05,155.932641,155.932603
1621,155.932717,192.168.43.125,103.208.137.6,TCP,54,49213  >  443 [ACK] Seq=3 Ack=2 Win=258 Len=0,,,,,,,,,,155.932781,155.932717,6.4E-05,155.932653,155.932589
1622,155.932781,103.208.137.6,192.168.43.125,TCP,54,"443  >  49180 [FIN, ACK] Seq=1 Ack=3 Win=501 Len=0",,,,,,,,,,155.932819,155.932781,3.8E-05,155.932743,155.932705
1623,155.932819,192.168.43.125,103.208.137.6,TCP,54,49180  >  443 [ACK] Seq=3 Ack=2 Win=255 Len=0,,,,,,,,,,155.932886,155.932819,6.7E-05,155.932752,155.932685
1624,155.932886,103.208.137.6,192.168.43.125,TCP,54,"443  >  49214 [FIN, ACK] Seq=1 Ack=3 Win=501 Len=0",,,,,,,,,,155.932922,155.932886,3.6E-05,155.93285,155.932814
1625,155.932922,192.168.43.125,103.208.137.6,TCP,54,49214  >  443 [ACK] Seq=3 Ack=2 Win=254 Len=0,,,,,,,,,,156.095341,155.932922,0.162419,155.770503,155.608084
1671,156.095341,192.168.43.125,74.125.24.149,TCP,66,49232  >  443 [SYN] Seq=0 Win=8192 Len=0 MSS=1460 WS=256 SACK_PERM=1,,,,,,,,,,156.130005,156.095341,0.034664,156.060677,156.026013
1676,156.130005,192.168.43.125,172.217.194.157,TCP,66,49233  >  443 [SYN] Seq=0 Win=8192 Len=0 MSS=1460 WS=256 SACK_PERM=1,,,,,,,,,,156.130677,156.130005,0.000672,156.129333,156.128661
1677,156.130677,192.168.43.125,172.217.194.157,TCP,66,49234  >  443 [SYN] Seq=0 Win=8192 Len=0 MSS=1460 WS=256 SACK_PERM=1,,,,,,,,,,156.225622,156.130677,0.094945,156.035732,155.940787
1688,156.225622,172.217.194.157,192.168.43.125,TCP,66,"443  >  49233 [SYN, ACK] Seq=0 Ack=1 Win=65535 Len=0 MSS=1380 SACK_PERM=1 WS=256",,,,,,,,,,156.225729,156.225622,0.000107,156.225515,156.225408
1689,156.225729,192.168.43.125,172.217.194.157,TCP,54,49233  >  443 [ACK] Seq=1 Ack=1 Win=66048 Len=0,,,,,,,,,,156.226591,156.225729,0.000862,156.224867,156.224005
1690,156.226591,192.168.43.125,172.217.194.157,TLSv1.3,571,Client Hello,,,,,,,,,,156.289529,156.226591,0.062938,156.163653,156.100715
1761,156.289529,172.217.194.157,192.168.43.125,TCP,54,443  >  49233 [ACK] Seq=1 Ack=518 Win=66816 Len=0,,,,,,,,,,156.291521,156.289529,0.001992,156.287537,156.285545
1762,156.291521,172.217.194.157,192.168.43.125,TLSv1.3,1434,"Server Hello, Change Cipher Spec",,,,,,,,,,156.292528,156.291521,0.001007,156.290514,156.289507
1763,156.292528,172.217.194.157,192.168.43.125,TCP,1434,443  >  49233 [ACK] Seq=1381 Ack=518 Win=66816 Len=1380 [TCP segment of a reassembled PDU],,,,,,,,,,156.292574,156.292528,4.6E-05,156.292482,156.292436
1764,156.292574,192.168.43.125,172.217.194.157,TCP,54,49233  >  443 [ACK] Seq=518 Ack=2761 Win=66048 Len=0,,,,,,,,,,156.292641,156.292574,6.7E-05,156.292507,156.29244
1765,156.292641,172.217.194.157,192.168.43.125,TLSv1.3,175,Application Data,,,,,,,,,,156.300768,156.292641,0.008127,156.284514,156.276387
1767,156.300768,192.168.43.125,172.217.194.157,TLSv1.3,118,"Change Cipher Spec, Application Data",,,,,,,,,,156.351012,156.300768,0.050244,156.250524,156.20028
1790,156.351012,74.125.24.149,192.168.43.125,TCP,66,"443  >  49231 [SYN, ACK] Seq=0 Ack=1 Win=65535 Len=0 MSS=1380 SACK_PERM=1 WS=256",,,,,,,,,,156.351105,156.351012,9.3E-05,156.350919,156.350826
1791,156.351105,192.168.43.125,74.125.24.149,TCP,54,49231  >  443 [ACK] Seq=1 Ack=1 Win=66048 Len=0,,,,,,,,,,156.354472,156.351105,0.003367,156.347738,156.344371
1799,156.354472,192.168.43.125,74.125.24.149,TLSv1.3,571,Client Hello,,,,,,,,,,156.370606,156.354472,0.016134,156.338338,156.322204
1804,156.370606,172.217.194.157,192.168.43.125,TLSv1.3,634,"Application Data, Application Data",,,,,,,,,,156.428779,156.370606,0.058173,156.312433,156.25426
1818,156.428779,74.125.24.149,192.168.43.125,TCP,54,443  >  49231 [ACK] Seq=1 Ack=518 Win=66816 Len=0,,,,,,,,,,156.429563,156.428779,0.000784,156.427995,156.427211
1821,156.429563,74.125.24.149,192.168.43.125,TLSv1.3,1434,"Server Hello, Change Cipher Spec",,,,,,,,,,156.478703,156.429563,0.04914,156.380423,156.331283
1881,156.478703,74.125.24.149,192.168.43.125,TCP,66,"443  >  49232 [SYN, ACK] Seq=0 Ack=1 Win=65535 Len=0 MSS=1380 SACK_PERM=1 WS=256",,,,,,,,,,156.478802,156.478703,9.9E-05,156.478604,156.478505
1882,156.478802,192.168.43.125,74.125.24.149,TCP,54,49232  >  443 [ACK] Seq=1 Ack=1 Win=66048 Len=0,,,,,,,,,,156.480059,156.478802,0.001257,156.477545,156.476288
1884,156.480059,192.168.43.125,74.125.24.149,TLSv1.3,571,Client Hello,,,,,,,,,,156.556579,156.480059,0.07652,156.403539,156.327019
1958,156.556579,74.125.24.149,192.168.43.125,TCP,54,443  >  49232 [ACK] Seq=1 Ack=518 Win=66816 Len=0,,,,,,,,,,156.565573,156.556579,0.008994,156.547585,156.538591
1959,156.565573,74.125.24.149,192.168.43.125,TLSv1.3,1434,"Server Hello, Change Cipher Spec",,,,,,,,,,156.569632,156.565573,0.004059,156.561514,156.557455
1962,156.569632,192.168.43.125,172.217.194.157,TCP,54,49233  >  443 [ACK] Seq=582 Ack=3462 Win=65536 Len=0,,,,,,,,,,156.629608,156.569632,0.059976,156.509656,156.44968
1988,156.629608,192.168.43.125,74.125.24.149,TCP,54,49231  >  443 [ACK] Seq=518 Ack=1381 Win=66048 Len=0,,,,,,,,,,156.769588,156.629608,0.13998,156.489628,156.349648
2018,156.769588,192.168.43.125,74.125.24.149,TCP,54,49232  >  443 [ACK] Seq=518 Ack=1381 Win=66048 Len=0,,,,,,,,,,157.27864,156.769588,0.509052,156.260536,155.751484
2038,157.27864,74.125.24.149,192.168.43.125,TCP,174,"[TCP Previous segment not captured] 443  >  49231 [PSH, ACK] Seq=2761 Ack=518 Win=66816 Len=120 [TCP segment of a reassembled PDU]",,,,,,,,,,157.278768,157.27864,0.000128,157.278512,157.278384
2039,157.278768,192.168.43.125,74.125.24.149,TCP,66,[TCP Dup ACK 1988#1] 49231  >  443 [ACK] Seq=518 Ack=1381 Win=66048 Len=0 SLE=2761 SRE=2881,,,,,,,,,,157.479318,157.278768,0.20055,157.078218,156.877668
2118,157.479318,74.125.24.149,192.168.43.125,TCP,174,"[TCP Previous segment not captured] 443  >  49232 [PSH, ACK] Seq=2761 Ack=518 Win=66816 Len=120 [TCP segment of a reassembled PDU]",,,,,,,,,,157.479434,157.479318,0.000116,157.479202,157.479086
2119,157.479434,192.168.43.125,74.125.24.149,TCP,66,[TCP Dup ACK 2018#1] 49232  >  443 [ACK] Seq=518 Ack=1381 Win=66048 Len=0 SLE=2761 SRE=2881,,,,,,,,,,157.55239,157.479434,0.072956,157.406478,157.333522
2156,157.55239,74.125.24.149,192.168.43.125,TCP,1434,[TCP Out-Of-Order] 443  >  49232 [ACK] Seq=1381 Ack=518 Win=66816 Len=1380,,,,,,,,,,157.552505,157.55239,0.000115,157.552275,157.55216
2157,157.552505,192.168.43.125,74.125.24.149,TCP,54,49232  >  443 [ACK] Seq=518 Ack=2881 Win=66048 Len=0,,,,,,,,,,157.577797,157.552505,0.025292,157.527213,157.501921
2169,157.577797,192.168.43.125,74.125.24.149,TLSv1.3,118,"Change Cipher Spec, Application Data",,,,,,,,,,157.580222,157.577797,0.002425,157.575372,157.572947
2172,157.580222,192.168.43.125,74.125.24.149,TLSv1.3,146,Application Data,,,,,,,,,,157.580991,157.580222,0.000769,157.579453,157.578684
2173,157.580991,192.168.43.125,74.125.24.149,TLSv1.3,841,Application Data,,,,,,,,,,157.652484,157.580991,0.071493,157.509498,157.438005
2183,157.652484,74.125.24.149,192.168.43.125,TLSv1.3,634,"Application Data, Application Data",,,,,,,,,,157.653184,157.652484,0.0007,157.651784,157.651084
2184,157.653184,192.168.43.125,74.125.24.149,TLSv1.3,85,Application Data,,,,,,,,,,157.687626,157.653184,0.034442,157.618742,157.5843
2201,157.687626,74.125.24.149,192.168.43.125,TLSv1.3,561,"[TCP Previous segment not captured] , Application Data",,,,,,,,,,157.687717,157.687626,9.1E-05,157.687535,157.687444
2202,157.687717,192.168.43.125,74.125.24.149,TCP,66,[TCP Dup ACK 2184#1] 49232  >  443 [ACK] Seq=1492 Ack=3461 Win=65536 Len=0 SLE=3492 SRE=3999,,,,,,,,,,157.687824,157.687717,0.000107,157.68761,157.687503
2203,157.687824,74.125.24.149,192.168.43.125,TLSv1.3,158,"Application Data, Application Data",,,,,,,,,,157.687863,157.687824,3.9E-05,157.687785,157.687746
2204,157.687863,192.168.43.125,74.125.24.149,TCP,66,[TCP Dup ACK 2184#2] 49232  >  443 [ACK] Seq=1492 Ack=3461 Win=65536 Len=0 SLE=3492 SRE=4103,,,,,,,,,,157.68793,157.687863,6.7E-05,157.687796,157.687729
2205,157.68793,74.125.24.149,192.168.43.125,TLSv1.3,93,Application Data,,,,,,,,,,157.687964,157.68793,3.4E-05,157.687896,157.687862
2206,157.687964,192.168.43.125,74.125.24.149,TCP,66,[TCP Dup ACK 2184#3] 49232  >  443 [ACK] Seq=1492 Ack=3461 Win=65536 Len=0 SLE=3492 SRE=4142,,,,,,,,,,157.892709,157.687964,0.204745,157.483219,157.278474
2297,157.892709,192.168.43.125,23.111.9.35,TCP,55,[TCP Keep-Alive] 49219  >  443 [ACK] Seq=1 Ack=4141 Win=64860 Len=1,,,,,,,,,,158.268741,157.892709,0.376032,157.516677,157.140645
2434,158.268741,23.111.9.35,192.168.43.125,TCP,66,[TCP Previous segment not captured] 443  >  49219 [ACK] Seq=8281 Ack=2 Win=31088 Len=0 SLE=1 SRE=2,,,,,,,,,,158.566377,158.268741,0.297636,157.971105,157.673469
2510,158.566377,74.125.24.149,192.168.43.125,TCP,85,"[TCP Retransmission] 443  >  49232 [PSH, ACK] Seq=3461 Ack=1492 Win=68352 Len=31",,,,,,,,,,158.566491,158.566377,0.000114,158.566263,158.566149
2511,158.566491,192.168.43.125,74.125.24.149,TCP,54,49232  >  443 [ACK] Seq=1492 Ack=4142 Win=64768 Len=0,,,,,,,,,,158.567829,158.566491,0.001338,158.565153,158.563815
2512,158.567829,192.168.43.125,74.125.24.149,TLSv1.3,93,Application Data,,,,,,,,,,159.125699,158.567829,0.55787,158.009959,157.452089
2551,159.125699,192.168.43.125,172.217.194.157,TCP,66,[TCP Retransmission] 49234  >  443 [SYN] Seq=0 Win=8192 Len=0 MSS=1460 WS=256 SACK_PERM=1,,,,,,,,,,159.635831,159.125699,0.510132,158.615567,158.105435
2560,159.635831,104.22.52.65,192.168.43.125,TLSv1.2,78,"[TCP Previous segment not captured] , Application Data",,,,,,,,,,159.635929,159.635831,9.8E-05,159.635733,159.635635
2561,159.635929,192.168.43.125,104.22.52.65,TCP,66,[TCP Dup ACK 77#1] 49221  >  443 [ACK] Seq=2 Ack=1 Win=256 Len=0 SLE=40 SRE=64,,,,,,,,,,159.636976,159.635929,0.001047,159.634882,159.633835
2562,159.636976,104.22.52.65,192.168.43.125,TCP,54,"443  >  49221 [FIN, ACK] Seq=64 Ack=2 Win=68 Len=0",,,,,,,,,,159.637052,159.636976,7.6E-05,159.6369,159.636824
2563,159.637052,192.168.43.125,104.22.52.65,TCP,66,[TCP Dup ACK 77#2] 49221  >  443 [ACK] Seq=2 Ack=1 Win=256 Len=0 SLE=40 SRE=64,,,,,,,,,,159.777072,159.637052,0.14002,159.497032,159.357012
2564,159.777072,74.125.24.149,192.168.43.125,TCP,1434,[TCP Retransmission] 443  >  49231 [ACK] Seq=1381 Ack=518 Win=66816 Len=1380,,,,,,,,,,159.777182,159.777072,0.00011,159.776962,159.776852
2565,159.777182,192.168.43.125,74.125.24.149,TCP,54,49231  >  443 [ACK] Seq=518 Ack=2881 Win=66048 Len=0,,,,,,,,,,159.786004,159.777182,0.008822,159.76836,159.759538
2566,159.786004,192.168.43.125,74.125.24.149,TLSv1.3,118,"Change Cipher Spec, Application Data",,,,,,,,,,159.866521,159.786004,0.080517,159.705487,159.62497
2570,159.866521,74.125.24.149,192.168.43.125,TLSv1.3,634,"Application Data, Application Data",,,,,,,,,,159.963119,159.866521,0.096598,159.769923,159.673325
2578,159.963119,104.22.52.65,192.168.43.125,TCP,93,"[TCP Retransmission] 443  >  49221 [PSH, ACK] Seq=1 Ack=2 Win=68 Len=39",,,,,,,,,,159.963295,159.963119,0.000176,159.962943,159.962767
2579,159.963295,192.168.43.125,104.22.52.65,TCP,54,49221  >  443 [ACK] Seq=2 Ack=65 Win=255 Len=0,,,,,,,,,,159.963765,159.963295,0.00047,159.962825,159.962355
2580,159.963765,192.168.43.125,104.22.52.65,TCP,54,"49221  >  443 [FIN, ACK] Seq=2 Ack=65 Win=255 Len=0",,,,,,,,,,160.065845,159.963765,0.10208,159.861685,159.759605
2599,160.065845,192.168.43.125,74.125.24.149,TCP,54,49231  >  443 [ACK] Seq=582 Ack=3461 Win=65536 Len=0,,,,,,,,,,160.219618,160.065845,0.153773,159.912072,159.758299
2620,160.219618,104.22.52.65,192.168.43.125,TCP,54,443  >  49221 [ACK] Seq=65 Ack=3 Win=68 Len=0,,,,,,,,,,160.254247,160.219618,0.034629,160.184989,160.15036
2622,160.254247,172.217.194.157,192.168.43.125,TCP,66,"443  >  49234 [SYN, ACK] Seq=0 Ack=1 Win=65535 Len=0 MSS=1380 SACK_PERM=1 WS=256",,,,,,,,,,160.254374,160.254247,0.000127,160.25412,160.253993
2623,160.254374,192.168.43.125,172.217.194.157,TCP,54,49234  >  443 [ACK] Seq=1 Ack=1 Win=66048 Len=0,,,,,,,,,,160.255653,160.254374,0.001279,160.253095,160.251816
2624,160.255653,192.168.43.125,172.217.194.157,TLSv1.3,645,Client Hello,,,,,,,,,,160.272812,160.255653,0.017159,160.238494,160.221335
2631,160.272812,192.168.43.125,74.125.24.149,TCP,93,"[TCP Retransmission] 49232  >  443 [PSH, ACK] Seq=1492 Ack=4142 Win=64768 Len=39",,,,,,,,,,160.346419,160.272812,0.073607,160.199205,160.125598
2639,160.346419,172.217.194.157,192.168.43.125,TLSv1.3,266,"Server Hello, Change Cipher Spec, Application Data",,,,,,,,,,160.346542,160.346419,0.000123,160.346296,160.346173
2640,160.346542,74.125.24.149,192.168.43.125,TCP,66,443  >  49232 [ACK] Seq=4142 Ack=1531 Win=68352 Len=0 SLE=1492 SRE=1531,,,,,,,,,,160.354017,160.346542,0.007475,160.339067,160.331592
2641,160.354017,192.168.43.125,172.217.194.157,TLSv1.3,118,"Change Cipher Spec, Application Data",,,,,,,,,,160.645823,160.354017,0.291806,160.062211,159.770405
2652,160.645823,192.168.43.125,172.217.194.157,TCP,118,"[TCP Retransmission] 49234  >  443 [PSH, ACK] Seq=592 Ack=213 Win=65792 Len=64",,,,,,,,,,160.676866,160.645823,0.031043,160.61478,160.583737
2655,160.676866,172.217.194.157,192.168.43.125,TLSv1.3,634,"Application Data, Application Data",,,,,,,,,,160.720054,160.676866,0.043188,160.633678,160.59049
2661,160.720054,172.217.194.157,192.168.43.125,TCP,66,[TCP Dup ACK 2655#1] 443  >  49234 [ACK] Seq=793 Ack=656 Win=66816 Len=0 SLE=592 SRE=656,,,,,,,,,,160.875746,160.720054,0.155692,160.564362,160.40867
2680,160.875746,192.168.43.125,172.217.194.157,TCP,54,49234  >  443 [ACK] Seq=656 Ack=793 Win=65280 Len=0,,,,,,,,,,160.94882,160.875746,0.073074,160.802672,160.729598
2701,160.94882,172.217.194.157,192.168.43.125,TLSv1.3,634,"[TCP Spurious Retransmission] , Application Data, Application Data",,,,,,,,,,160.948904,160.94882,8.4E-05,160.948736,160.948652
2702,160.948904,192.168.43.125,172.217.194.157,TCP,66,[TCP Dup ACK 2680#1] 49234  >  443 [ACK] Seq=656 Ack=793 Win=65280 Len=0 SLE=213 SRE=793,,,,,,,,,,188.855883,160.948904,27.906979,133.041925,105.134946
5525,188.855883,192.168.43.125,74.125.24.138,TCP,55,[TCP Keep-Alive] 49227  >  443 [ACK] Seq=1 Ack=1 Win=255 Len=1,,,,,,,,,,188.934132,188.855883,0.078249,188.777634,188.699385
5526,188.934132,74.125.24.138,192.168.43.125,TCP,66,[TCP Keep-Alive ACK] 443  >  49227 [ACK] Seq=1 Ack=2 Win=265 Len=0 SLE=1 SRE=2,,,,,,,,,,198.723182,188.934132,9.78905,179.145082,169.356032
6285,198.723182,192.168.43.125,74.125.68.188,TCP,55,[TCP Keep-Alive] 49171  >  5228 [ACK] Seq=1 Ack=1 Win=256 Len=1,,,,,,,,,,198.791456,198.723182,0.068274,198.654908,198.586634
6296,198.791456,74.125.68.188,192.168.43.125,TCP,66,[TCP Keep-Alive ACK] 5228  >  49171 [ACK] Seq=1 Ack=2 Win=265 Len=0 SLE=1 SRE=2,,,,,,,,,,201.373221,198.791456,2.581765,196.209691,193.627926
6554,201.373221,192.168.43.125,172.217.194.157,TCP,55,[TCP Keep-Alive] 49233  >  443 [ACK] Seq=581 Ack=3462 Win=65536 Len=1,,,,,,,,,,203.267258,201.373221,1.894037,199.479184,197.585147
6734,203.267258,192.168.43.125,23.111.9.35,TCP,55,[TCP Keep-Alive] 49219  >  443 [ACK] Seq=1 Ack=4141 Win=64860 Len=1,,,,,,,,,,203.408014,203.267258,0.140756,203.126502,202.985746
6735,203.408014,74.125.24.138,192.168.43.125,TCP,54,"[TCP Previous segment not captured] 443  >  49227 [FIN, ACK] Seq=57 Ack=2 Win=265 Len=0",,,,,,,,,,203.4081,203.408014,8.6E-05,203.407928,203.407842
6736,203.4081,192.168.43.125,74.125.24.138,TCP,54,[TCP Dup ACK 26#1] 49227  >  443 [ACK] Seq=2 Ack=1 Win=255 Len=0,,,,,,,,,,203.68767,203.4081,0.27957,203.12853,202.84896
6737,203.68767,74.125.24.138,192.168.43.125,TCP,110,"[TCP Retransmission] 443  >  49227 [FIN, PSH, ACK] Seq=1 Ack=2 Win=265 Len=56",,,,,,,,,,203.687787,203.68767,0.000117,203.687553,203.687436
6738,203.687787,192.168.43.125,74.125.24.138,TCP,54,49227  >  443 [ACK] Seq=2 Ack=58 Win=255 Len=0,,,,,,,,,,203.688208,203.687787,0.000421,203.687366,203.686945
6739,203.688208,192.168.43.125,74.125.24.138,TCP,54,"49227  >  443 [FIN, ACK] Seq=2 Ack=58 Win=255 Len=0",,,,,,,,,,203.753537,203.688208,0.065329,203.622879,203.55755
6740,203.753537,74.125.24.138,192.168.43.125,TCP,54,443  >  49227 [ACK] Seq=58 Ack=3 Win=265 Len=0,,,,,,,,,,204.867331,203.753537,1.113794,202.639743,201.525949
6745,204.867331,192.168.43.125,74.125.24.149,TCP,55,[TCP Keep-Alive] 49231  >  443 [ACK] Seq=581 Ack=3461 Win=65536 Len=1,,,,,,,,,,205.039434,204.867331,0.172103,204.695228,204.523125
6750,205.039434,74.125.24.149,192.168.43.125,TCP,66,[TCP Keep-Alive ACK] 443  >  49231 [ACK] Seq=3461 Ack=582 Win=66816 Len=0 SLE=581 SRE=582,,,,,,,,,,205.353432,205.039434,0.313998,204.725436,204.411438
6771,205.353432,192.168.43.125,74.125.24.149,TCP,55,[TCP Keep-Alive] 49232  >  443 [ACK] Seq=1530 Ack=4142 Win=64768 Len=1,,,,,,,,,,205.441718,205.353432,0.088286,205.265146,205.17686
6780,205.441718,74.125.24.149,192.168.43.125,TCP,66,[TCP Keep-Alive ACK] 443  >  49232 [ACK] Seq=4142 Ack=1531 Win=68352 Len=0 SLE=1530 SRE=1531,,,,,,,,,,205.717431,205.441718,0.275713,205.166005,204.890292
6812,205.717431,192.168.43.125,172.217.194.157,TCP,55,[TCP Keep-Alive] 49234  >  443 [ACK] Seq=655 Ack=793 Win=65280 Len=1,,,,,,,,,,205.789429,205.717431,0.071998,205.645433,205.573435
6820,205.789429,172.217.194.157,192.168.43.125,TCP,66,[TCP Keep-Alive ACK] 443  >  49234 [ACK] Seq=793 Ack=656 Win=66816 Len=0 SLE=655 SRE=656,,,,,,,,,,243.792825,205.789429,38.003396,167.786033,129.782637
9922,243.792825,192.168.43.125,74.125.68.188,TCP,55,[TCP Keep-Alive] 49171  >  5228 [ACK] Seq=1 Ack=1 Win=256 Len=1,,,,,,,,,,246.372923,243.792825,2.580098,241.212727,238.632629
10091,246.372923,192.168.43.125,172.217.194.157,TCP,55,[TCP Keep-Alive] 49233  >  443 [ACK] Seq=581 Ack=3462 Win=65536 Len=1,,,,,,,,,,246.447512,246.372923,0.074589,246.298334,246.223745
10101,246.447512,172.217.194.157,192.168.43.125,TCP,66,[TCP Keep-Alive ACK] 443  >  49233 [ACK] Seq=3462 Ack=582 Win=66816 Len=0 SLE=581 SRE=582,,,,,,,,,,248.26893,246.447512,1.821418,244.626094,242.804676
10273,248.26893,192.168.43.125,23.111.9.35,TCP,55,[TCP Keep-Alive] 49219  >  443 [ACK] Seq=1 Ack=4141 Win=64860 Len=1,,,,,,,,,,248.622543,248.26893,0.353613,247.915317,247.561704
10302,248.622543,23.111.9.35,192.168.43.125,TCP,66,[TCP Keep-Alive ACK] 443  >  49219 [ACK] Seq=8281 Ack=2 Win=31088 Len=0 SLE=1 SRE=2,,,,,,,,,,250.038025,248.622543,1.415482,247.207061,245.791579
10432,250.038025,192.168.43.125,74.125.24.149,TCP,55,[TCP Keep-Alive] 49231  >  443 [ACK] Seq=581 Ack=3461 Win=65536 Len=1,,,,,,,,,,250.442963,250.038025,0.404938,249.633087,249.228149
10466,250.442963,192.168.43.125,74.125.24.149,TCP,55,[TCP Keep-Alive] 49232  >  443 [ACK] Seq=1530 Ack=4142 Win=64768 Len=1,,,,,,,,,,250.789055,250.442963,0.346092,250.096871,249.750779
10500,250.789055,192.168.43.125,172.217.194.157,TCP,55,[TCP Keep-Alive] 49234  >  443 [ACK] Seq=655 Ack=793 Win=65280 Len=1,,,,,,,,,,288.793433,250.789055,38.004378,212.784677,174.780299
11780,288.793433,192.168.43.125,74.125.68.188,TCP,55,[TCP Keep-Alive] 49171  >  5228 [ACK] Seq=1 Ack=1 Win=256 Len=1,,,,,,,,,,288.870428,288.793433,0.076995,288.716438,288.639443
11781,288.870428,74.125.68.188,192.168.43.125,TCP,66,[TCP Keep-Alive ACK] 5228  >  49171 [ACK] Seq=1 Ack=2 Win=265 Len=0 SLE=1 SRE=2,,,,,,,,,,291.453507,288.870428,2.583079,286.287349,283.70427
11783,291.453507,192.168.43.125,172.217.194.157,TCP,55,[TCP Keep-Alive] 49233  >  443 [ACK] Seq=581 Ack=3462 Win=65536 Len=1,,,,,,,,,,291.5375,291.453507,0.083993,291.369514,291.285521
11784,291.5375,172.217.194.157,192.168.43.125,TCP,66,[TCP Keep-Alive ACK] 443  >  49233 [ACK] Seq=3462 Ack=582 Win=66816 Len=0 SLE=581 SRE=582,,,,,,,,,,293.620606,291.5375,2.083106,289.454394,287.371288
11793,293.620606,192.168.43.125,23.111.9.35,TCP,55,[TCP Keep-Alive] 49219  >  443 [ACK] Seq=1 Ack=4141 Win=64860 Len=1,,,,,,,,,,293.984209,293.620606,0.363603,293.257003,292.8934
11796,293.984209,23.111.9.35,192.168.43.125,TCP,66,[TCP Keep-Alive ACK] 443  >  49219 [ACK] Seq=8281 Ack=2 Win=31088 Len=0 SLE=1 SRE=2,,,,,,,,,,295.03771,293.984209,1.053501,292.930708,291.877207
11798,295.03771,192.168.43.125,74.125.24.149,TCP,55,[TCP Keep-Alive] 49231  >  443 [ACK] Seq=581 Ack=3461 Win=65536 Len=1,,,,,,,,,,295.443589,295.03771,0.405879,294.631831,294.225952
11799,295.443589,192.168.43.125,74.125.24.149,TCP,55,[TCP Keep-Alive] 49232  >  443 [ACK] Seq=1530 Ack=4142 Win=64768 Len=1,,,,,,,,,,295.790661,295.443589,0.347072,295.096517,294.749445
11800,295.790661,192.168.43.125,172.217.194.157,TCP,55,[TCP Keep-Alive] 49234  >  443 [ACK] Seq=655 Ack=793 Win=65280 Len=1,,,,,,,,,,295.87726,295.790661,0.086599,295.704062,295.617463
11801,295.87726,172.217.194.157,192.168.43.125,TCP,66,[TCP Keep-Alive ACK] 443  >  49234 [ACK] Seq=793 Ack=656 Win=66816 Len=0 SLE=655 SRE=656,,,,,,,,,,305.884527,295.87726,10.007267,285.869993,275.862726
11817,305.884527,192.168.43.125,74.125.24.149,TCP,54,"49231  >  443 [FIN, ACK] Seq=582 Ack=3461 Win=65536 Len=0",,,,,,,,,,305.884681,305.884527,0.000154,305.884373,305.884219
11818,305.884681,192.168.43.125,172.217.194.157,TCP,54,"49233  >  443 [FIN, ACK] Seq=582 Ack=3462 Win=65536 Len=0",,,,,,,,,,305.884786,305.884681,0.000105,305.884576,305.884471
11819,305.884786,192.168.43.125,172.217.194.157,TCP,54,"49234  >  443 [FIN, ACK] Seq=656 Ack=793 Win=65280 Len=0",,,,,,,,,,305.943258,305.884786,0.058472,305.826314,305.767842
11823,305.943258,192.168.43.125,74.125.200.94,TCP,66,49235  >  443 [SYN] Seq=0 Win=8192 Len=0 MSS=1460 WS=256 SACK_PERM=1,,,,,,,,,,305.95113,305.943258,0.007872,305.935386,305.927514
11824,305.95113,74.125.24.149,192.168.43.125,TCP,54,"443  >  49231 [FIN, ACK] Seq=3461 Ack=583 Win=66816 Len=0",,,,,,,,,,305.951236,305.95113,0.000106,305.951024,305.950918
11825,305.951236,192.168.43.125,74.125.24.149,TCP,54,49231  >  443 [ACK] Seq=583 Ack=3462 Win=65536 Len=0,,,,,,,,,,305.951354,305.951236,0.000118,305.951118,305.951
11826,305.951354,172.217.194.157,192.168.43.125,TCP,54,"443  >  49234 [FIN, ACK] Seq=793 Ack=657 Win=66816 Len=0",,,,,,,,,,305.951396,305.951354,4.2E-05,305.951312,305.95127
11827,305.951396,192.168.43.125,172.217.194.157,TCP,54,49234  >  443 [ACK] Seq=657 Ack=794 Win=65280 Len=0,,,,,,,,,,306.063571,305.951396,0.112175,305.839221,305.727046
11829,306.063571,74.125.200.94,192.168.43.125,TCP,66,"443  >  49235 [SYN, ACK] Seq=0 Ack=1 Win=65535 Len=0 MSS=1380 SACK_PERM=1 WS=256",,,,,,,,,,306.06367,306.063571,9.9E-05,306.063472,306.063373
11830,306.06367,192.168.43.125,74.125.200.94,TCP,54,49235  >  443 [ACK] Seq=1 Ack=1 Win=66048 Len=0,,,,,,,,,,306.064728,306.06367,0.001058,306.062612,306.061554
11831,306.064728,192.168.43.125,74.125.200.94,TLSv1.3,571,Client Hello,,,,,,,,,,306.172324,306.064728,0.107596,305.957132,305.849536
11832,306.172324,74.125.200.94,192.168.43.125,TCP,54,443  >  49235 [ACK] Seq=1 Ack=518 Win=66816 Len=0,,,,,,,,,,306.172829,306.172324,0.000505,306.171819,306.171314
11833,306.172829,74.125.200.94,192.168.43.125,TLSv1.3,1434,"Server Hello, Change Cipher Spec",,,,,,,,,,306.174898,306.172829,0.002069,306.17076,306.168691
